course_code,section,title,credit_hours,meeting_info,instructor,description,section_description,section_expectations,evaluation,soc_comments,semester,prerequisites,other_requirements,uncertain
CS 1080,"Section A, CRN 91695",Intro to Web Site Dev,3,TTh 4:25pm-5:40pm in JAMES M JEFFORDS HALL 127 (8/25 to 12/5),Murat Gungor,"Provides a strong foundation in HTML, CSS, images, beginning web programming, and web design so that the student can create a complete functional web site in a team based final project.","Lays a foundation in website coding with HTML, CSS, JavaScript, images, and basic web design, empowering students to create a functional website.",Assumes no prior experience with programming.,"Quizzes, Active Learning Exercises, Lab Exercises, Projects",Open to Degree and PACE students,Fall and Spring 2025,,['Open to Degree and PACE students'],False
CS 1210,"Section F, CRN 92166",Comp Prog I: for CS majors,3,TTh 2:50pm-4:05pm in MARSH LIFE SCI 105 (8/25 to 12/5),Sami Connolly,Introduction to algorithmic problem solving and computer programming. Designed to provide a foundation for further studies in computer science.,Introduction to programming and computer science with Python.,Assumes no prior experience with programming. Student should have high school algebra.,,"Open to CS, CSIS, and DS majors only",Fall 2025,,"['Open to CS, CSIS, and DS majors only']",False
CS 1210,"Section B, CRN 90147",Computer Programming I,3,TTh 8:30am-9:45am in VOTEY BLDG 207 (8/25 to 12/5),Sami Connolly,Introduction to algorithmic problem solving and computer programming. Designed to provide a foundation for further studies in computer science.,Introduction to programming with Python.,Assumes no prior experience with programming.,"Weekly homework, lab and active learning exercises. Two exams (no final exam). Final project.",Open to Degree and PACE students,Fall and Spring 2025,,['Open to Degree and PACE students'],False
CS 1320,"Section A, CRN 94171","Puzzles, Games & Algorithms",3,MWF 10:50am-11:40am in VOTEY BLDG 303 (8/25 to 12/5),Lisa Dion,"Introductory computer science through exploration and analysis of mathematical puzzles and games, and the algorithms that handle them. Prerequisite: No credit if taken after CS 2100.","In this course, you will explore computational thinking through the analysis of mathematical puzzles and games, and the algorithms that handle them. Learning objectives include:
- To engage in productive struggle and data collection to solve common puzzles and understand common mathematical games through computational thinking
- To understand, appreciate, and communicate various approaches and algorithms to solving the games and puzzles
- To connect the puzzles and games to real-world applications and transfer the knowledge and understanding to help shape real-world decisions and actions","This course is taught in an active learning style, so class attendance will be crucial. You will be expected to work for 6 hours outside of class each week, per University policy regarding work required for a 3 credit hour course.","This course is taught using a points-based system. Each week a few assignments will be released, with varying formats and point values. Your final grade will be based on the number of points you accumulate by the end of the semester.",Open to Degree and PACE students,Fall and Spring 2025,,['Open to Degree and PACE students'],False
CS 1500,"Section A, CRN 90913",Seminar for New CS Majors,1,F 2:20pm-3:10pm in VOTEY BLDG 105 (8/25 to 12/5),Sami Connolly,A fun and accessible breadth-first introduction to the CS community and curricula at UVM. CS faculty serve as guest lecturers to introduce new CS majors to selected topics covered in upper division UVM CS electives. Prerequisites: Computer Science or Computer Science & Information Systems majors who have not yet completed CS 2100. Co-requisite: CS 1210 or CS 2100.,"This course is intended to introduce new Computer Science majors to the UVM CS degree program.

Course goals:
- Build community among CS students and faculty
- Give students an appreciation of the breadth of CS
- Excite students about advanced CS electives
- Help students navigate the various curricular options in CS at UVM
- Help students begin for a transition to a career in CS","You will be expected to attend each lecture period and complete written assignments outside of class time. You will be expected to work for 2 hours outside of class each week, per University policy regarding work required for a 1-credit-hour course.","Your final grade will be based on pre-class writeups, post-class quizzes, and occasional homework assignments.","CS, CSIS, or Data Science majors only",Fall 2025,,"['Computer Science or Computer Science & Information Systems majors who have not yet completed CS 2100', 'CS, CSIS, or Data Science majors only']",False
CS 1640,"Section A, CRN 90230",Discrete Structures,3,MWF 1:10pm-2pm in PERKINS BUILDING 003 (8/25 to 12/5),Jeffrey Jewell,"Introduction to analytic and formal methods of computer science with practical examples, including analysis or data structures, recursion relations, proof methods, and logic programming. Credit not awarded for both CS 1640 and MATH 2055. Prerequisites: CS 1210 or CS 2100; MATH 1234 or MATH 1242.",,,,"Prereqs enforced by the system: (CS 1210 or 2100) and
(MATH 1234 or 1242);
Open to Degree and PACE students",Fall 2025,"{'AND': [{'OR': ['CS 1210', 'CS 2100']}, {'OR': ['MATH 1234', 'MATH 1242']}]}",['Open to Degree and PACE students'],False
CS 1870,"Section A, CRN 92324",Intro to Data Science,3,MWF 1:10pm-2pm in VOTEY BLDG 209 (8/25 to 12/5),Roger Tenore,"Basic techniques of data harvesting and cleaning; association rules, classification and clustering; analyze, manipulate, and visualize data using programming languages. Basic principles of probability and statistical modeling/inference to make meaning out of large datasets. Credit not awarded after STAT 3000 or greater. Cross-listed with: STAT 1870.",,,,"Cross-listed with STAT 1870 A;
Total combined enrollment: 45;
Open to Degree and PACE students",Fall 2025,,['Open to Degree and PACE students'],False
CS 1994,,Teaching Assistantship,Varies by section,,,Assist in instruction of undergraduate computer science courses under the direct supervision of a faculty member. Instructor permission required.,,,,Varies by section,Fall and Spring 2025,,['Instructor permission required'],False
CS 2100,,Intermediate Programming,Varies by section,,Jackie Horton,"Intermediate programming concepts including common data structures, algorithms, style, design, documentation, testing and debugging techniques, and an introduction to object-oriented programming. Prerequisite: CS 1210 with a grade of C- or better.",,,,Varies by section,Fall and Spring 2025,CS 1210,[],False
CS 2210,,Computer Organization,3,,Clayton Cafiero,"Introduction to computer system organization including performance, assembly language, machine-level data representation, arithmetic for computers, processor datapath control, memory, and input/output. Includes significant semester project. Cross-listed with: CMPE 2210. Prerequisite: CS 2100.",,,,Varies by section,Fall and Spring 2025,CS 2100,[],False
CS 2240,,Data Struc & Algorithms,3,,,"Design and implementation of linear structures, trees and graphs. Examples of common algorithmic paradigms. Theoretical and empirical complexity analysis. Sorting, searching, and basic graph algorithms. Prerequisites: CS 2100 with a grade of C- or better; minimum Sophomore standing.","You will learn the common data structures for abstract data types and algorithms, including lists, trees, heaps, sorting, hashing, and disjoint set finding/uniting. You will also consider and compare their performances.
Course goals and objectives:
1) You will gain knowledge of different data structures and recognize the use cases for each.
2) You will consider not just whether algorithms function correctly or not, but also their efficiency and performance as the amount of data grows.
3) You will use the C++ programming language to collect data with and analyze data structures and algorithms.","This class is run lecture-style with practice problems and active learning activities sprinkled throughout. You will be expected to work for 6 hours outside of class each week, per University policy regarding work required for a 3 credit hour course.","Your final grade will be based on quizzes, programming projects, active learning activities, surveys, and a final exam.",Varies by section,Fall and Spring 2025,{'AND': ['CS 2100']},['minimum Sophomore standing'],False
CS 2250,,Computability& Complexity,3,,,Formal languages and expressiveness. Turing completeness and Church's Thesis. Decidability and tractability. Complexity classes and theory of NP completeness. Prerequisites: CS 1640 or MATH 2055. Co-requisite: CS 2240.,,,,"Prereqs enforced by the system: CS 1640 or MATH 2055;
Coreq: CS 2240;
Open to Degree and PACE students",Fall and Spring 2025,"{'OR': ['CS 1640', 'MATH 2055']}",['Open to Degree and PACE students'],False
CS 2300,,Advanced Programming,3,,Lisa Dion,"Builds programming maturity and proficiency through significant projects with spiral development, including program specification, design, implementation, debugging, testing, validation, internal and external documentation. Focus on advanced topics including efficiency, profiling, modularity, extensibility, programming paradigms, design patterns, memory management, and generics. Prerequisite: CS 2240.","This project-based course is separated into four modules. You will learn the details of C++ through a mixture of guided and open-ended projects, oral/written assignments, and other activities. An emphasis will be put on creativity and collaboration.

Course goals and objectives include:
1) To master C++ programming.
2) To expand programming knowledge to projects that require multiple languages.
3) To explore event-based programming through C++ graphics projects.
4) To develop the skills necessary to effectively collaborate in teams.","Every three-week module will be themed and will have lectures, active learning activities, and assignments associated with it. You will be expected to work for 6 hours outside of class each week, per University policy regarding work required for a 3 credit hour course.","This course uses a point-based grading system, where you get to choose which assignments you want to complete to earn points towards your final grade.","Prereqs enforced by the system: CS 2240;
Open to Degree and PACE students",Fall and Spring 2025,CS 2240,['Open to Degree and PACE students'],False
CS 2500,"Section A, CRN 94648",Intro to Database Systems,3,MW 3:30pm-4:45pm in INNOVATION HALL E204 (8/25 to 12/5),Jackie Horton,"Serves as a foundational course in modern database systems. Introduces the fundamental concepts and techniques of relational database management, data modeling, relational algebra, structured query language, database design and database management.  Practical experience will be gained through a series of labs and projects. Credit not awarded after CS 3040 or CS 5040. Prerequisites: CS 1210; minimum Sophomore standing. Pre/Co-requisites: CS 1210; minimum Sophomore standing.","This course will serve as a foundational course in modern database systems. Students will be introduced to the fundamental concepts and techniques of relational database management, data modeling, relational algebra, structured query language, database design and database management.  The course will make extensive use of Python to interface with SQLite. Practical experience will be gained through a series of labs and projects.  Credit not awarded after CS 3040 or CS5040.

Pre-req:  CS21/CS1210 and sophomore standing.  Strong Python skills will be required.",Completion of CS1210. Sophomore Standing.,,"Prereqs enforced by the system: CS 1210
Open to degree and PACE students",Fall and Spring 2025,{'AND': ['CS 1210']},"['minimum Sophomore standing', 'Open to degree and PACE students']",False
CS 2510,,Intro Artificial Intelligence,3,,Clayton Cafiero,"An introduction to artificial intelligence including logic and rule-based approaches, heuristic search, A*, IDA*, minimax, alpha/beta pruning, expectiminimax, Markov models and MDPs, decision tree, ensemble learning / random forest, the neural model and simple multi-layer perceptrons. Other topics, if any may vary. Prerequisite: C- or better in CS 2240.",,,,Prereqs enforced by the system: CS 2240,Fall and Spring 2025,CS 2240,[],False
CS 2660,"Section OL1, CRN 13197",Cybersecurity Principles,3,,James Eddy,"Introduction to cybersecurity, fundamental security design principles, programming flaws, malicious code, web and database security, cryptography algorithms and hashing functions; overview of computer networks and common network threat vectors. Prerequisites: CS 2210 with a grade of C- or better.",,,,"Prereqs enforced by the system: CS 2210 with a
grade of C- ;
Asynchronous Online Course;
Open to Degree and PACE students",Spring 2026,CS 2210,['Open to Degree and PACE students'],False
CS 2870,,Basics of Data Science,3,,Jacob Martin,"Basic data science techniques, from import to cleaning to visualizing and modeling, using the R language. Machine learning methods include regression, classification and clustering algorithms. Programming methods include user-defined functions. Prerequisite: STAT 1110, STAT 1410, or STAT 2430. Cross-listed with: STAT 2870.",,,,Varies by section,Fall 2025,"{'OR': ['STAT 1110', 'STAT 1410', 'STAT 2430']}",[],False
CS 2920,"Section A, CRN 12182",SL:Girls Who Code,1,,Lisa Dion,Service learning experience that benefits the University or the Community under the direction of a CS faculty member. Prerequisite: Instructor permission.,This is for students who help facilitate the UVM Girls Who Code club on Saturday mornings. We teach local K-12 girls the basics in programming.,"You will be expected to attend the club every Saturday, participate in reflections and planning before and after each session, and lead the session a few times during the semester.","You will be evaluated based on attendance, completion of tasks, being a good role model for the girls, lesson planning, and leadership.","Instructor permission required;
Open to Degree and PACE students",Fall and Spring 2025,,"['Instructor permission', 'Open to Degree and PACE students']",False
CS 2993,,Independent Study,Varies by section,,,"A course which is tailored to fit the interests of a specific student, which occurs outside the traditional classroom/laboratory setting under the supervision of a faculty member, for which credit is awarded. Offered at department discretion.",,,,Varies by section,Fall 2025,,['Offered at department discretion'],False
CS 2994,,Teaching Assistantship,1 to 3,,,"Undergraduate student service as a teaching assistant, usually in an introductory-level course in the discipline, for which credit is awarded. Offered at department discretion.",,,,Varies by section,Fall and Spring 2025,,['Department consent'],False
CS 3010,"Section A, CRN 90238",Operating Systems,3,MWF 12pm-12:50pm in VOTEY BLDG 207 (8/25 to 12/5),Jason Hibbeler,"Supervisory and control software for multiprogrammed computer systems. Processes, threads, synchronization, interprocess communication, scheduling, memory management, resource allocation, performance evaluation, secondary storage, case studies. Prerequisites: CS 2300 and CS 2210.","CS 3010 will provide a broad overview of operating systems, focused primarily on Linux.  We will pursue an in-depth investigation of the following topics: the OS kernel and kernel mode; concurrency and threads; synchronization and deadlock;, scheduling algorithms; virtual-memory management; I/O devices; and file-system management.

From this course, students will become proficient in developing system-level programs in C.

The recommended text will be Operating System Concepts: Principles and Practice, 2nd Edition, by Anderson and Dahlin.",Students will learn concepts by creating several C programs on Linux that apply the various concepts from class.  There will be a midterm exam and a final exam; several short Brightspace quizzes covering concepts from the lectures; and in-class practice worksheets.,Course grades will be based on the midterm and final exams; the programming projects; the Brightspace quizzes covering concepts from the lectures; and attendance.,"Prereqs enforced by the system: CS 2210 and CS 2300
Open to degree and PACE students",Fall and Spring 2025,"{'AND': ['CS 2300', 'CS 2210']}",['Open to degree and PACE students'],False
CS 3040,"Section A, CRN 93083",Database Systems,3,MWF 8:30am-9:20am in MARSH LIFE SCI 105 (8/25 to 12/5),Byung Lee,Techniques for processing very large collections of data. Secondary storage. Database design and management. Query languages and optimization. Database recovery. Credit not awarded for both CS 3040 and CS 5040. Prerequisite: CS 2240.,"Theory and practice of database design and application programming, and basic internals of a database management system. Specific topics include database concepts, data models and database design, query languages, database programming concepts and languages, files and physical design, query processing and optimization, transaction concepts, concurrency control and recovery, and access control.","Lecture course. 6 to 8 hours of work expected outside the classroom.  Prerequisite: Familiarity with basic data structures, algorithms, discrete mathematics, and computer organization. Required text: Ramez Elmasri and Sham Navathe, Fundamentals of Database Systems (7th edition), Pearson, 2016.","Weekly homework, including written and programming. Class attendance.","Prereqs enforced by the system: CS 2240;
Colocated with CS 5040 A;
Total combined enrollment: 45;
Open to Degree and PACE students",Fall 2025,CS 2240,"['Familiarity with basic data structures', 'algorithms', 'discrete mathematics', 'computer organization', 'Open to Degree and PACE students']",False
CS 3050,"Section A, CRN 11825",Software Engineering,3,MWF 3:30pm-4:20pm UNASSIGNED (1/12 to 5/1),Jason Hibbeler,"Treatment of software engineering problems and principles, with a focus on iterative software development. A significant part of the course is devoted to two multi-week team projects. Prerequisite: CS 2300.","CS 3050 will present a broad overview of the many activities involved in software engineering.  In particular, we will devote particular attention requirements engineering and to iterative software development.  We will also cover additional topics including design and implementation, verification, evolution, and software maintenance.  Students will learn and make use of automated frameworks for analyzing, testing, and documenting source code.

Students will acquire the skills needed to work constructively in an agile framework (Kanban, Scrum) on a large-scale team project and will learn to use git effectively.

The recommended text is Essentials of Software Engineering, by Tsui, Karam, and Bernal (ISBN 1284106004).","There will be three individual in-class coding challenges in Python, a short team programming project, and large team programming project that will span approximately half the semester.  There will be two exams.  Students must be able to work effectively as part of a team.","Course grades will be based on in-class coding challenges, on the exams, and on the two team projects.  The team projects will count for a significant portion of the course grade.  In addition, students will present material in writing and orally in class, and these presentations will count towards the course grade.  Students will also be evaluated on their ability to work as part of the team.  Class attendance will also count towards the course grade.","Prereqs enforced by the system: CS 2300;
Project presentation session: Feb 12th, 6-9 PM;
Open to Degree and PACE students",Spring 2026,CS 2300,['Open to Degree and PACE students'],False
CS 3060,"Section A, CRN 10577",Evolutionary Robotics,3,TTh 8:30am-9:45am UNASSIGNED (1/12 to 5/1),Joshua Bongard,"Exploration of the automated design of autonomous machines using evolutionary algorithms. Coursework involves reading of research papers, programming assignments and a final project. Credit not awarded for both CS 3060 and CS 5060. Prerequisites: Junior standing and programming experience, or Instructor permission.",,,,"Prereq: Junior standing and programming experience
or instructor permission; Co-located with CS 5060 A;
Total combined enrollment: 60;
Open to Degree and PACE students",Spring 2026,,"['Junior standing', 'programming experience', 'Instructor permission', 'Open to Degree and PACE students']",False
CS 3110,"Section A, CRN 92684",Data Privacy,3,MWF 1:10pm-2pm in DEWEY HALL 314 (8/25 to 12/5),Joe Near,"Explores the research field of data privacy, including privacy attacks on anonymized data, and formal approaches like k-Anonymity and differential privacy. Applies the theory of data privacy to real problems in programming projects. Credit not awarded for both CS 3110 and CS 5110 Prerequisites: CS 2240, CS 2250.","How can we learn from sensitive data collected from individuals, while protecting the privacy of those individuals?

This question is central to the study of data privacy, and is increasingly relevant with the widespread collection of our personal data. Analysis of this data can lead to important benefits for society, including advances in medicine and public infrastructure, but can also result in privacy breaches that expose our most closely-held secrets.

This course will explore both threats to privacy and solutions to the data privacy problem. We will demonstrate that traditional approaches to protecting privacy, such as anonymization, are subject to powerful attacks that reveal individuals’ sensitive data. We will see that while more recent approaches for protecting privacy, including k-anonymity and l-diversity, are more resistant to these attacks, they are not immune.

Then, we will explore recent formal notions of privacy, including differential privacy. Differential privacy provides a rigorous formal definition of individual privacy that enables a wide range of statistical analyses while protecting privacy. We will explore a number of differentially private algorithms for analytics and machine learning, and learn about the algorithmic building blocks and proof techniques used to develop them.

In addition to learning about the mathematical foundations of differential privacy, we will explore its practical implications. We will learn about existing practical systems for enforcing differential privacy and examine the challenges of building such systems. This course will include programming assignments and an end-of-semester project, in which students are expected to demonstrate both mastery of the concepts we explore and understanding of their practical implications by building their own systems that perform privacy-preserving analyses on real data.","This course will be structured around lectures and a weekly programming assignment. Each lecture will cover concepts in ensuring data privacy; in the corresponding programming assignment, you will implement algorithms corresponding to these concepts. Students should expect to spend 5-6 hours per week outside of class on the weekly programming assignments. The required materials for this course are all freely available online.","Your grade for the course will be determined as follows:

    10 homework assignments (5% each; 50% total)
    exams (20% total)
    in-class exercises (20% total)
    final project (10%)

Homework Assignments

This course will use Python for examples and for programming assignments. Students are expected to be proficient in Python programming. Programming assignments will be distributed and turned in as Jupyter notebooks. See this page for information on installing Jupyter; the Anaconda method is recommended, since it also installs the other libraries we will use in the course.","Prereqs enforced by the system: CS 2240 and CS 2250;
Co-located with CS 5110 A;
Total combined enrollment: 70
Open to degree and PACE students",Fall 2025,"{'AND': ['CS 2240', 'CS 2250']}",['Open to degree and PACE students'],False
